Complaint ID,Sender,Subject,Body,Received At,Root Cause,Suggested Solution,Processed At
COMP-001,john.doe@hospital.com,Quality Issue - Torn Gloves,Multiple gloves from batch #GL2023-456 are tearing during use. This is causing serious concerns for staff safety. The tears typically appear around the thumb area when the gloves are being put on. We've had 5 incidents reported in the past week.,2024-03-20T09:30:00,"The gloves from batch #GL2023-456 are tearing during use, particularly around the thumb area when being put on. This indicates a potential issue with the material quality or manufacturing process of this specific batch.",1. Immediately halt the use of gloves from batch #GL2023-456. 2. Contact the supplier to report the issue and request a replacement batch. 3. Conduct a thorough quality check on the replacement batch before use. 4. Consider switching to a different supplier if the issue persists.,2025-05-25T15:02:12.248619
COMP-002,sarah.smith@clinic.org,Allergic Reaction to Gloves,"Several staff members reported skin irritation and rashes after using gloves from batch #GL2023-789. The symptoms appear within 30 minutes of wear and include redness, itching, and mild swelling. This affects about 20% of our staff who used this batch.",2024-03-20T10:15:00,The skin irritation and rashes experienced by staff members are likely due to an allergic reaction to the materials used in the gloves from batch #GL2023-789. This could be caused by the presence of certain chemicals or substances in the gloves that are not compatible with the skin of some individuals.,1. Immediately discontinue the use of gloves from batch #GL2023-789. 2. Provide affected staff members with alternative gloves that are hypoallergenic and have been tested for skin compatibility. 3. Conduct a thorough investigation into the materials used in the gloves from batch #GL2023-789 to identify the specific cause of the allergic reaction. 4. Implement stricter quality control measures to ensure that all future batches of gloves are free from substances that may cause skin irritation or allergic reactions. 5. Provide training to staff members on proper glove usage and the importance of reporting any adverse reactions immediately.,2025-05-25T15:02:16.881407
COMP-003,mike.wilson@medlab.com,Inconsistent Sizing,The medium size gloves from recent shipment (batch #GL2023-567) are significantly larger than our previous orders. This is causing handling issues during delicate procedures. The variation seems to be about 1-2 sizes larger than standard medium size.,2024-03-20T11:00:00,"The medium size gloves from batch #GL2023-567 are significantly larger than the standard medium size, causing handling issues during delicate procedures.","1. Verify the sizing specifications of the gloves in batch #GL2023-567 against the standard medium size. 2. If the gloves are indeed larger, contact the supplier to report the issue and request a replacement batch with the correct sizing. 3. In the meantime, consider using a different batch or size of gloves to ensure proper handling during delicate procedures.",2025-05-25T15:02:20.607369
COMP-004,emily.chen@surgery.net,Powder Residue Issue,"Despite ordering powder-free gloves (batch #GL2023-890), we're finding significant powder residue inside the gloves. This is causing contamination concerns during sterile procedures. The residue is visible on dark surfaces and transfers to hands and instruments.",2024-03-20T13:45:00,The root cause of the issue is that the gloves are not powder-free as advertised. The powder residue inside the gloves is causing contamination concerns during sterile procedures.,The suggested solution is to return the gloves to the supplier and request a refund. The supplier should also be notified of the issue so that they can take steps to prevent it from happening again.,2025-05-25T15:02:24.060805
COMP-005,david.brown@healthcare.com,Packaging Damage,Received a shipment where 30% of the boxes show water damage (order #ORD2023-123). The sterile packaging of individual glove pairs appears compromised in these boxes. This affects approximately 50 boxes from the shipment received on March 15th.,2024-03-20T15:20:00,"Water damage to 30% of the boxes in shipment #ORD2023-123, compromising the sterile packaging of individual glove pairs.",1. Quarantine the affected boxes to prevent further contamination. 2. Contact the supplier to report the issue and request a replacement shipment. 3. Conduct a thorough inspection of the remaining boxes to ensure they are not affected. 4. Review the shipping and handling procedures to prevent similar incidents in the future.,2025-05-25T15:02:27.824643
COMP-006,lisa.jones@hospital.com,Defective Seams,Batch #GL2023-901 shows consistent seam defects along the wrist area. Several gloves have split at the seams during procedures. This is a critical safety concern that needs immediate attention.,2024-03-21T09:00:00,Invalid Format,Response was not in JSON format. Raw response: I will provide the analysis in JSON format with root_cause and suggested_solution.,2025-05-25T15:02:30.177079
COMP-007,robert.zhang@clinic.org,Color Variation Issue,"The latest shipment of blue nitrile gloves (batch #GL2023-902) shows significant color variation. Some gloves are much lighter than standard, making it difficult to distinguish from white latex gloves, which is a potential safety issue.",2024-03-21T10:30:00,"The color variation in the blue nitrile gloves is likely due to inconsistencies in the manufacturing process, specifically in the dyeing stage. This could be caused by variations in dye concentration, temperature, or mixing during production.","To resolve this issue, the manufacturer should review and adjust their dyeing process to ensure consistent color across all gloves. This may involve calibrating equipment, standardizing dye concentrations, and implementing stricter quality control measures. Additionally, the affected batch should be recalled and replaced with gloves that meet the required color standards to ensure patient safety and compliance with industry regulations.",2025-05-25T15:02:34.210683
COMP-008,maria.garcia@medcenter.com,Packaging Error,Received mixed sizes in boxes labeled as 'Large' (batch #GL2023-903). Each box contains approximately 20% medium size gloves. This is causing delays during procedures when staff need to verify sizes.,2024-03-21T11:45:00,"The root cause of the issue is that the boxes labeled as 'Large' contain approximately 20% medium size gloves, which is causing delays during procedures when staff need to verify sizes.","To resolve this issue, the supplier should ensure that the boxes labeled as 'Large' contain only large size gloves. The supplier should also implement a quality control process to ensure that the correct sizes are being shipped. Additionally, the hospital should consider implementing a system to verify the sizes of the gloves before they are used in procedures.",2025-05-25T15:02:39.461874
COMP-009,james.wilson@surgery.org,Static Issue,Excessive static in gloves from batch #GL2023-904 is causing problems during precise procedures. The static is attracting small particles and making it difficult to handle small instruments accurately.,2024-03-21T13:15:00,Invalid Format,Response was not in JSON format. Raw response: I will analyze the complaint and provide a response in JSON format with root_cause and suggested_solution.,2025-05-25T15:02:42.546182
COMP-010,anna.patel@healthcare.net,Thickness Inconsistency,"Noticed significant thickness variation in gloves from batch #GL2023-905. Some gloves are too thin and lack proper protection, while others are too thick and reduce tactile sensitivity.",2024-03-21T14:30:00,Inconsistent thickness in gloves from batch #GL2023-905,"Review manufacturing process for batch #GL2023-905, identify cause of thickness variation, and implement corrective actions to ensure consistent glove thickness in future batches.",2025-05-25T15:02:46.651622
COMP-011,thomas.anderson@hospital.org,Expired Product Delivery,Received a shipment of gloves (batch #GL2023-906) with expiration dates already passed. The entire batch shows manufacturing date of 2021 and expiration of early 2024.,2024-03-21T15:45:00,Processing Error,"Failed to process after 3 attempts: API Error: Error calling AI API: HTTP 429: {""error"": {""message"": ""Rate limit exceeded: free-models-per-day. Add 10 credits to unlock 1000 free model requests per day"", ""code"": 429, ""metadata"": {""headers"": {""X-RateLimit-Limit"": ""50"", ""X-RateLimit-Remaining"": ""0"", ""X-RateLimit-Reset"": ""1748217600000""}, ""provider_name"": null}}, ""user_id"": ""user_2xaaqbPUrJgGd4DovrdO6s2BBiO""}",2025-05-25T15:02:52.041172
COMP-012,susan.lee@clinic.com,Chemical Odor,Strong chemical odor detected in batch #GL2023-907. Staff members report headaches and nausea after prolonged use. Concerned about potential chemical exposure.,2024-03-21T16:30:00,Processing Error,"Failed to process after 3 attempts: API Error: Error calling AI API: HTTP 429: {""error"": {""message"": ""Rate limit exceeded: free-models-per-day. Add 10 credits to unlock 1000 free model requests per day"", ""code"": 429, ""metadata"": {""headers"": {""X-RateLimit-Limit"": ""50"", ""X-RateLimit-Remaining"": ""0"", ""X-RateLimit-Reset"": ""1748217600000""}, ""provider_name"": null}}, ""user_id"": ""user_2xaaqbPUrJgGd4DovrdO6s2BBiO""}",2025-05-25T15:02:58.785379
COMP-013,peter.walsh@medlab.org,Texture Issue,"Batch #GL2023-908 has an unusually slippery texture, making it difficult to grip instruments securely. This is particularly problematic during surgical procedures requiring precise handling.",2024-03-22T09:15:00,Processing Error,"Failed to process after 3 attempts: API Error: Error calling AI API: HTTP 429: {""error"": {""message"": ""Rate limit exceeded: free-models-per-day. Add 10 credits to unlock 1000 free model requests per day"", ""code"": 429, ""metadata"": {""headers"": {""X-RateLimit-Limit"": ""50"", ""X-RateLimit-Remaining"": ""0"", ""X-RateLimit-Reset"": ""1748217600000""}, ""provider_name"": null}}, ""user_id"": ""user_2xaaqbPUrJgGd4DovrdO6s2BBiO""}",2025-05-25T15:03:04.485449
COMP-014,rachel.kim@surgery.com,Box Count Discrepancy,Multiple boxes from batch #GL2023-909 contain fewer gloves than specified. Boxes labeled as 100 pieces consistently contain only 90-95 gloves.,2024-03-22T10:45:00,Processing Error,"Failed to process after 3 attempts: API Error: Error calling AI API: HTTP 429: {""error"": {""message"": ""Rate limit exceeded: free-models-per-day. Add 10 credits to unlock 1000 free model requests per day"", ""code"": 429, ""metadata"": {""headers"": {""X-RateLimit-Limit"": ""50"", ""X-RateLimit-Remaining"": ""0"", ""X-RateLimit-Reset"": ""1748217600000""}, ""provider_name"": null}}, ""user_id"": ""user_2xaaqbPUrJgGd4DovrdO6s2BBiO""}",2025-05-25T15:03:09.211103
COMP-015,michael.brown@healthcare.org,Sterilization Indicator Missing,Sterilization indicators missing from batch #GL2023-910 packaging. Cannot verify if the gloves meet sterility requirements for surgical procedures. Entire shipment of 100 boxes affected.,2024-03-22T11:30:00,Processing Error,"Failed to process after 3 attempts: API Error: Error calling AI API: HTTP 429: {""error"": {""message"": ""Rate limit exceeded: free-models-per-day. Add 10 credits to unlock 1000 free model requests per day"", ""code"": 429, ""metadata"": {""headers"": {""X-RateLimit-Limit"": ""50"", ""X-RateLimit-Remaining"": ""0"", ""X-RateLimit-Reset"": ""1748217600000""}, ""provider_name"": null}}, ""user_id"": ""user_2xaaqbPUrJgGd4DovrdO6s2BBiO""}",2025-05-25T15:03:16.073073
